{
  "id": "eos.task.padel-iot.test-planning",
  "title": "Test planning",
  "description": "Software/cloud validation strategy",
  "objective": "Produce eos.artifact.padel-iot.test-strategy",
  "project_id": "eos.project.padel-iot",
  "capability_ids": [
    "eos.capability.quality.test-planning"
  ],
  "role_ids": [
    "eos.role.qa-test-engineer"
  ],
  "input_artifact_ids": [
    "eos.artifact.padel-iot.system-architecture"
  ],
  "output_artifact_ids": [
    "eos.artifact.padel-iot.test-strategy"
  ],
  "depends_on_task_ids": [
    "eos.task.padel-iot.design-architecture"
  ],
  "status": "pending",
  "priority": "high",
  "risk": "high"
}
