{
  "id": "eos.task.rivallium.test-planning",
  "title": "Test planning",
  "description": "Test strategy for booking flows",
  "objective": "Produce/update eos.artifact.rivallium.test-strategy",
  "project_id": "eos.project.rivallium",
  "capability_ids": [
    "eos.capability.quality.test-planning"
  ],
  "role_ids": [
    "eos.role.qa-test-engineer"
  ],
  "input_artifact_ids": [
    "eos.artifact.rivallium.architecture"
  ],
  "output_artifact_ids": [
    "eos.artifact.rivallium.test-strategy"
  ],
  "depends_on_task_ids": [
    "eos.task.rivallium.design-architecture"
  ],
  "status": "pending",
  "priority": "medium",
  "risk": "medium"
}
